<p:person xmlns:p="http://www.tbrc.org/models/person#" xmlns:xsi="http://www.w3.org/2001/XMLSchema-instance" RID="P1331" status="released" xsi:schemaLocation="http://www.tbrc.org/models/person# person.xsd">
    <p:name lang="tibetan" encoding="extendedWylie" type="primaryName">blo gros rnam dag</p:name>
    <p:name lang="tibetan" encoding="extendedWylie" type="primaryTitle">bya yul blo bzang rnam dag</p:name>
    <p:info gender="male"/>
    <p:event pid="E7285" type="death" circa="1322"/>
    <p:seat>
        <p:place pid="G844">bya yul</p:place>
    </p:seat>
    <p:teacherOf pid="P1323">don grub dpal ba</p:teacherOf>
    <p:note work="W20115" location="p. 359">date of death from this source</p:note>
</p:person>
